{
  "spec_version": "1",
  "mark": "L1-SA-LAYOUT",
  "units": "mm",
  "mode": "layout",
  "title_block": { "project": "Synthetic demo office", "drawing_title": "Level 1 supply air layout", "drawing_no": "M-101", "revision": "A", "date": "2026-10-11", "drawn_by": "MEP Co-pilot (draft)" },
  "ducts": [
    { "tag": "D1", "system": "SA-1", "size": { "shape": "rect", "width_mm": 600, "depth_mm": 300 }, "airflow_ls": 600, "start_mm": [0, 0], "end_mm": [6000, 0] },
    { "tag": "D2", "system": "SA-1", "size": { "shape": "rect", "width_mm": 400, "depth_mm": 300 }, "airflow_ls": 400, "start_mm": [6000, 0], "end_mm": [6000, 4000] },
    { "tag": "D3", "system": "SA-1", "size": { "shape": "round", "diameter_mm": 300 }, "airflow_ls": 200, "start_mm": [3000, 0], "end_mm": [3000, -3000] }
  ],
  "terminals": [
    { "tag": "T1", "system": "SA-1", "airflow_ls": 200, "at_mm": [6000, 4000] },
    { "tag": "T2", "system": "SA-1", "airflow_ls": 200, "at_mm": [6000, 2000] },
    { "tag": "T3", "system": "SA-1", "airflow_ls": 200, "at_mm": [3000, -3000] }
  ],
  "sizing_schedule": [
    { "tag": "D1", "size": { "shape": "rect", "width_mm": 600, "depth_mm": 300 }, "airflow_ls": 600 },
    { "tag": "D2", "size": { "shape": "rect", "width_mm": 400, "depth_mm": 300 }, "airflow_ls": 400 },
    { "tag": "D3", "size": { "shape": "round", "diameter_mm": 300 }, "airflow_ls": 200 }
  ]
}
